{
  "contract_version": "1.0.0",
  "experience_id": "EXP-20260918-STAGE-06-HYPOTHESIS-1-1F0B0C",
  "project_id": "project_default",
  "task_id": "stage_06_hypothesis_1",
  "agent": "statistics-agent",
  "skill": "statistical-data-analyst",
  "start_time": "2026-09-18T18:56:26.450229+00:00",
  "end_time": "2026-09-18T18:56:26.450229+00:00",
  "duration_seconds": 1.0,
  "outcome": "SUCCESS",
  "artifact_references": [
    {
      "path": "projects/study_act_burnout/03_deliverables/stage_06_hypothesis_1/06_hypothesis_1.docx",
      "sha256": "70ca51e10f06a0bc1e7ad703d2d36fb394f0d65fa21d3796faf4a7c8b246295e",
      "type": "docx"
    },
    {
      "path": "projects/study_act_burnout/03_deliverables/stage_06_hypothesis_1/06_hypothesis_1.json",
      "sha256": "c5da0ac98c2b5ecc01776858e4687a1fff98128714d3fcbf1e495a038aaf7156",
      "type": "json"
    },
    {
      "path": "projects/study_act_burnout/03_deliverables/stage_06_hypothesis_1/06_hypothesis_1.md",
      "sha256": "f43c2bb04cec68f0735a1093082c578abee0e070312429d3783c861c798b74e1",
      "type": "md"
    },
    {
      "path": "projects/study_act_burnout/03_deliverables/stage_06_hypothesis_1/execution_manifest.json",
      "sha256": "623f68aae679e739eba411134a0a33e3357a3d1fd908719314d3d0710d8f4424",
      "type": "json"
    },
    {
      "path": "projects/study_act_burnout/03_deliverables/stage_06_hypothesis_1/pitfall_challenge_report.json",
      "sha256": "89d605a91d46585db14b0b001b7bc2460bff2d33c455205de7e515327aaf602d",
      "type": "json"
    },
    {
      "path": "projects/study_act_burnout/03_deliverables/stage_06_hypothesis_1/statistical_audit_report.json",
      "sha256": "7b37da51eebf7665d341378061b04960877722fe9364f78d0d5dd0186da09392",
      "type": "json"
    },
    {
      "path": "projects/study_act_burnout/03_deliverables/stage_06_hypothesis_1/stats_results.json",
      "sha256": "c5da0ac98c2b5ecc01776858e4687a1fff98128714d3fcbf1e495a038aaf7156",
      "type": "json"
    },
    {
      "path": "projects/study_act_burnout/03_deliverables/stage_06_hypothesis_1/stats_summary.md",
      "sha256": "e8b17006441ea8a443747168023fe6a2fd55af9685d6be2bef44527a3653a82d",
      "type": "md"
    },
    {
      "path": "projects/study_act_burnout/03_deliverables/stage_06_hypothesis_1/stats_table.md",
      "sha256": "d7e01704ced452f0b1a91d9bba1cb0d1666250b647558ee119ff6e4284d6d335",
      "type": "md"
    }
  ],
  "validation_status": {
    "verdict": "PASS",
    "checks_passed": 3,
    "checks_failed": 0
  },
  "metadata": {
    "stage_dir": "/home/ghaderi-saber/Desktop/AcademicSuite/projects/study_act_burnout/03_deliverables/stage_06_hypothesis_1",
    "triad_complete": true
  }
}