{
  "contract_version": "1.0.0",
  "experience_id": "EXP-20260918-STAGE-06-HYPOTHESIS-1-06EB19",
  "project_id": "project_default",
  "task_id": "stage_06_hypothesis_1",
  "agent": "statistics-agent",
  "skill": "statistical-data-analyst",
  "start_time": "2026-09-18T17:33:10.990603+00:00",
  "end_time": "2026-09-18T17:33:10.990603+00:00",
  "duration_seconds": 1.0,
  "outcome": "SUCCESS",
  "artifact_references": [
    {
      "path": "projects/test_study_e2e/03_deliverables/stage_06_hypothesis_1/06_hypothesis_1.docx",
      "sha256": "1566197905886a890378220ad078003a5848aae3d77cb49da330fc614caff3da",
      "type": "docx"
    },
    {
      "path": "projects/test_study_e2e/03_deliverables/stage_06_hypothesis_1/06_hypothesis_1.json",
      "sha256": "7ffa7d92b96051bc599e48b76a97599146d0fe390c912db5560f03350b76b0cb",
      "type": "json"
    },
    {
      "path": "projects/test_study_e2e/03_deliverables/stage_06_hypothesis_1/06_hypothesis_1.md",
      "sha256": "4eea4a6fabcbe6639039064932559dd2eb0bc64ec117d549d427bea1f4b6cefe",
      "type": "md"
    },
    {
      "path": "projects/test_study_e2e/03_deliverables/stage_06_hypothesis_1/execution_manifest.json",
      "sha256": "b4b6b746fedb349d095ba144eb78726b6cea1824ea8856ad4aa1c3243051ba12",
      "type": "json"
    },
    {
      "path": "projects/test_study_e2e/03_deliverables/stage_06_hypothesis_1/stats_results.json",
      "sha256": "7ffa7d92b96051bc599e48b76a97599146d0fe390c912db5560f03350b76b0cb",
      "type": "json"
    },
    {
      "path": "projects/test_study_e2e/03_deliverables/stage_06_hypothesis_1/stats_summary.md",
      "sha256": "9943789aab9344a57f55c43c8178ce5170c5797cc48b77730a2b5d206aeabd01",
      "type": "md"
    },
    {
      "path": "projects/test_study_e2e/03_deliverables/stage_06_hypothesis_1/stats_table.md",
      "sha256": "bd0523a3f1fd3e7e6bc680d13501fe6eb24e03a4158d0d53b7dc8b9bf6af640c",
      "type": "md"
    }
  ],
  "validation_status": {
    "verdict": "PASS",
    "report_id": "VAL-2026-E2E-CH4-HYPO1",
    "checks_passed": 1,
    "checks_failed": 0
  },
  "metadata": {
    "stage_dir": "/home/ghaderi-saber/Desktop/AcademicSuite/projects/test_study_e2e/03_deliverables/stage_06_hypothesis_1",
    "triad_complete": true
  }
}