{
  "contract_version": "1.0.0",
  "experience_id": "EXP-20260919-OUTPUTS-BF49C9",
  "project_id": "project_default",
  "task_id": "outputs",
  "agent": "statistics-agent",
  "skill": "academic-suite-orchestrator",
  "start_time": "2026-09-19T03:42:01.061719+00:00",
  "end_time": "2026-09-19T03:42:01.061719+00:00",
  "duration_seconds": 1.0,
  "outcome": "SUCCESS",
  "artifact_references": [
    {
      "path": "projects/study_vertical_slice_experimental/academic-state/outputs/00_data_curation_report.docx",
      "sha256": "07e1002b4d57440119c133a3433e4b85ea9a40c47014db793948c2cbab181799",
      "type": "docx"
    },
    {
      "path": "projects/study_vertical_slice_experimental/academic-state/outputs/00_data_curation_report.json",
      "sha256": "9e5b609d83c75c20579941e2a403620e63d634a380fa2daaece052f60185f07a",
      "type": "json"
    },
    {
      "path": "projects/study_vertical_slice_experimental/academic-state/outputs/00_data_curation_report.md",
      "sha256": "338d6a750fc711f4e72b2f00c14c4af524743e322c6415d9df2256b43da40830",
      "type": "md"
    },
    {
      "path": "projects/study_vertical_slice_experimental/academic-state/outputs/01_demographics.docx",
      "sha256": "33de02da44e9c3ff4df02dbe1371206fc146f17264fbd23cbf1226f6a8d8f925",
      "type": "docx"
    },
    {
      "path": "projects/study_vertical_slice_experimental/academic-state/outputs/01_demographics.json",
      "sha256": "3f94b998350a4c25558b0ff3b87b5a5776694505b23896e056b233c0e7397e99",
      "type": "json"
    },
    {
      "path": "projects/study_vertical_slice_experimental/academic-state/outputs/01_demographics.md",
      "sha256": "f19d3f44a08c5703fac1a3c0aa45beb921f5fe414d857e2b2026eb0899590afa",
      "type": "md"
    },
    {
      "path": "projects/study_vertical_slice_experimental/academic-state/outputs/02_descriptives_and_reliability.docx",
      "sha256": "8e655f7eb1d0473db0cb493fb278c01df5f174bffeff8d3423157bf6f64c45da",
      "type": "docx"
    },
    {
      "path": "projects/study_vertical_slice_experimental/academic-state/outputs/02_descriptives_and_reliability.json",
      "sha256": "2e23b52f606769c7cf377c2896f3ea44995593083f3fbb24e0fd23a19b7fcce8",
      "type": "json"
    },
    {
      "path": "projects/study_vertical_slice_experimental/academic-state/outputs/02_descriptives_and_reliability.md",
      "sha256": "abf0cb8c8a68bac3cfd81bc11f85e2d44394599c5b4a86693a8fa59355ed867e",
      "type": "md"
    },
    {
      "path": "projects/study_vertical_slice_experimental/academic-state/outputs/03_experimental_assumptions.docx",
      "sha256": "0eb7cdf23c0d87239ecc12de3a374b895640ad6cf00842db986c004bd6544063",
      "type": "docx"
    },
    {
      "path": "projects/study_vertical_slice_experimental/academic-state/outputs/03_experimental_assumptions.json",
      "sha256": "fb060e310f452912ecf477df6081599ed5ad043a0b973dfaaad01a8039eae581",
      "type": "json"
    },
    {
      "path": "projects/study_vertical_slice_experimental/academic-state/outputs/03_experimental_assumptions.md",
      "sha256": "40b4dafa70dc1f68014aa7f9f76ed87bd5b662543b6df046f3b2fbd8f34046cf",
      "type": "md"
    },
    {
      "path": "projects/study_vertical_slice_experimental/academic-state/outputs/04_bivariate_correlations.docx",
      "sha256": "1ec6be513263d4c478ca43fa5921b01d3e0434975abd47b658005157f2a8bc44",
      "type": "docx"
    },
    {
      "path": "projects/study_vertical_slice_experimental/academic-state/outputs/04_bivariate_correlations.json",
      "sha256": "0b2560d25da9e913a335c343543e9c35e667662761ec985ca77e1b10bdd341d6",
      "type": "json"
    },
    {
      "path": "projects/study_vertical_slice_experimental/academic-state/outputs/04_bivariate_correlations.md",
      "sha256": "e8a7a909c584374ec18a1eb55a8a84fcea4724244a961a6b22a5cb047a24d3da",
      "type": "md"
    },
    {
      "path": "projects/study_vertical_slice_experimental/academic-state/outputs/06_hypothesis_1_ancova_post.docx",
      "sha256": "c71f185f636bb51bfbb539be13a8f7c21358dcb57b5b1a1fe65e81942b58033f",
      "type": "docx"
    },
    {
      "path": "projects/study_vertical_slice_experimental/academic-state/outputs/06_hypothesis_1_ancova_post.json",
      "sha256": "2bf31f045cc24f25226293e7c2a2e058af41957954af80e8d6347dfccc696dae",
      "type": "json"
    },
    {
      "path": "projects/study_vertical_slice_experimental/academic-state/outputs/06_hypothesis_1_ancova_post.md",
      "sha256": "d7d6bbf25c60da001568d230e8f9d23430650de26ef963a05aa5a6741e14c003",
      "type": "md"
    },
    {
      "path": "projects/study_vertical_slice_experimental/academic-state/outputs/07_hypothesis_2_ancova_followup.docx",
      "sha256": "c7b3c1648ae4738efa73c3cf6c0395f971c39477c9784187d4faa267778186d0",
      "type": "docx"
    },
    {
      "path": "projects/study_vertical_slice_experimental/academic-state/outputs/07_hypothesis_2_ancova_followup.json",
      "sha256": "c0c6df72bbdc296fcadc916a1978070a52059f97e15102a147ae30b0fcc9ab30",
      "type": "json"
    },
    {
      "path": "projects/study_vertical_slice_experimental/academic-state/outputs/07_hypothesis_2_ancova_followup.md",
      "sha256": "0000e3b99e0aac0878113f65429810c5c3edca4f4acf459bc7365627117fcbcf",
      "type": "md"
    },
    {
      "path": "projects/study_vertical_slice_experimental/academic-state/outputs/08_hypothesis_3_repeated_measures.docx",
      "sha256": "c6395176a9a15dbb5cb9249928a4e5d709e7198eaec788e0741e73f6f13bc4f4",
      "type": "docx"
    },
    {
      "path": "projects/study_vertical_slice_experimental/academic-state/outputs/08_hypothesis_3_repeated_measures.json",
      "sha256": "3750902319ecb8d215ef8f3de2b47f239bd49821f5cae2fb35a0edddc9a5755e",
      "type": "json"
    },
    {
      "path": "projects/study_vertical_slice_experimental/academic-state/outputs/08_hypothesis_3_repeated_measures.md",
      "sha256": "26f8c2a4fd1c4089b84a0f780e4d467b845ef022678bf108607054ad11948c87",
      "type": "md"
    },
    {
      "path": "projects/study_vertical_slice_experimental/academic-state/outputs/09_chapter_summary.docx",
      "sha256": "efe815c13eac51fa53b0189594e3f70071a956252a4af47db58ea7a09ca3d08e",
      "type": "docx"
    },
    {
      "path": "projects/study_vertical_slice_experimental/academic-state/outputs/09_chapter_summary.json",
      "sha256": "0f146dde36a5d8e025706c2e36b813199f69cc53fbe83a52bba3c65c736e6e79",
      "type": "json"
    },
    {
      "path": "projects/study_vertical_slice_experimental/academic-state/outputs/09_chapter_summary.md",
      "sha256": "bd4d2f66264f5775b5503cba8e16da56731fd721645c323b4de35463042b5d09",
      "type": "md"
    },
    {
      "path": "projects/study_vertical_slice_experimental/academic-state/outputs/10_defense_brief.docx",
      "sha256": "2aba0fed134c48b1868fae4ece8f37f3ab22270adf61ae4981af88f38a779a68",
      "type": "docx"
    },
    {
      "path": "projects/study_vertical_slice_experimental/academic-state/outputs/10_defense_brief.json",
      "sha256": "ca852371a12ac6fccddf3da136c02b9abf31da9928e824a4e9ee2aa3a4697dfa",
      "type": "json"
    },
    {
      "path": "projects/study_vertical_slice_experimental/academic-state/outputs/10_defense_brief.md",
      "sha256": "0ca33a632727e8f2ca1b992ecae448914de2ec30b5f8e28f9b9492379883daef",
      "type": "md"
    },
    {
      "path": "projects/study_vertical_slice_experimental/academic-state/outputs/data_cleaned.xlsx",
      "sha256": "65a5de47b036b0a9c2f2986a0f4f7f580a8444d1ce842cb5346e49975753c82b",
      "type": "xlsx"
    }
  ],
  "validation_status": {
    "verdict": "PASS",
    "checks_passed": 3,
    "checks_failed": 0
  },
  "metadata": {
    "stage_dir": "/home/ghaderi-saber/Desktop/AcademicSuite/projects/study_vertical_slice_experimental/academic-state/outputs",
    "triad_complete": true
  }
}